{
  "$schema": "https://json-schema.org/draft/2020-12/schema",
  "$id": "https://notmaster.dev/nm-v6/schemas/administrator-acceptance-v1.schema.json",
  "title": "NM V6 administrator implementation acceptance",
  "type": "object",
  "required": [
    "schema_version",
    "decision",
    "spec_id",
    "spec_version",
    "spec_hash",
    "source_change_digest",
    "base_sha",
    "head_sha",
    "acceptance_result_sha256",
    "independent_review_sha256",
    "recommended",
    "production_ready",
    "recorded_at",
    "authority_basis"
  ],
  "properties": {
    "schema_version": {"const": "nm-v6/administrator-acceptance-v1"},
    "decision": {"const": "accepted"},
    "spec_id": {"const": "SPEC-NM-WORKFLOW-V6-V1"},
    "spec_version": {"const": 1},
    "spec_hash": {
      "const": "62196ab27c2be08ea1c716081903a009185f1d518ba7a53ed9b3d8485236cb7f"
    },
    "source_change_digest": {"$ref": "#/$defs/sha256"},
    "base_sha": {"$ref": "#/$defs/gitCommit"},
    "head_sha": {"$ref": "#/$defs/gitCommit"},
    "acceptance_result_sha256": {"$ref": "#/$defs/sha256"},
    "independent_review_sha256": {"$ref": "#/$defs/sha256"},
    "recommended": {"const": false},
    "production_ready": {"const": false},
    "recorded_at": {
      "type": "string",
      "format": "date-time",
      "pattern": "^[0-9]{4}-[0-9]{2}-[0-9]{2}T[0-9]{2}:[0-9]{2}:[0-9]{2}(?:\\.[0-9]+)?(?:Z|[+-][0-9]{2}:[0-9]{2})$"
    },
    "authority_basis": {
      "type": "string",
      "minLength": 1,
      "maxLength": 512,
      "pattern": "^[^\\r\\n]+$"
    }
  },
  "additionalProperties": false,
  "$defs": {
    "sha256": {"type": "string", "pattern": "^[0-9a-f]{64}$"},
    "gitCommit": {"type": "string", "pattern": "^[0-9a-f]{40,64}$"}
  }
}
